{
  "job_id": "00000000-0000-4000-8000-000000000006",
  "stage": "09_QA",
  "config_source": "public",
  "config_version": "v1",
  "model": "not_reported",
  "execution_id": "exec-0006",
  "created_at": "2026-10-22T12:00:00Z",
  "cover_spec_id": "cs-0002",
  "gates": [
    {
      "gate_id": "QA-DIM",
      "status": "passed",
      "detail": "1080x1350"
    },
    {
      "gate_id": "QA-OVF",
      "status": "failed",
      "detail": "line 1 is 951.2 px, room is 930 px"
    },
    {
      "gate_id": "QA-SAFE",
      "status": "passed",
      "detail": "all slots inside the 64 px margin"
    },
    {
      "gate_id": "QA-CTR",
      "status": "passed",
      "detail": "lowest ratio 7.4:1"
    },
    {
      "gate_id": "QA-NUM",
      "status": "passed",
      "detail": "2 of 2 numbers allowed"
    },
    {
      "gate_id": "QA-CFM",
      "status": "passed",
      "detail": "0 blocked terms; footer present"
    }
  ],
  "passed": false
}
